What is a capital?	A capital is the city or town that functions as the seat of government and administrative centre of a country or region.
Definition of capital	A capital is the city or town that functions as the seat of government and administrative centre of a country or region.
What a capital is?	A capital is the city or town that functions as the seat of government and administrative centre of a country or region.
What is a country?	The term country refers to a political state or nation or its territory. It is often referred to as the land of an individual's birth, residence, or citizenship. Countries can refer both to sovereign states and to other political entities, while other times it can refer only to states.
Definition of a country	The term country refers to a political state or nation or its territory. It is often referred to as the land of an individual's birth, residence, or citizenship. Countries can refer both to sovereign states and to other political entities, while other times it can refer only to states.
What a country is?	The term country refers to a political state or nation or its territory. It is often referred to as the land of an individual's birth, residence, or citizenship. Countries can refer both to sovereign states and to other political entities, while other times it can refer only to states.


